{
  "$schema": "https://json-schema.org/draft/2020-12/schema",
  "$id": "https://steam302-web.local/schemas/rule",
  "title": "Service rule catalog entry",
  "description": "一条服务的完整规则定义。每个 config/rules/*.json 描述一个可独立开关的服务。",
  "type": "object",
  "required": [
    "schema_version",
    "name",
    "group",
    "enabled",
    "sites"
  ],
  "properties": {
    "schema_version": {
      "const": 1
    },
    "id": {
      "type": "string",
      "pattern": "^[a-z0-9_]+$",
      "description": "机器可读唯一标识，用于 WebUI/命令行开关。缺省取文件名"
    },
    "name": {
      "type": "string",
      "description": "展示名称，如 'Steam 社区解锁'"
    },
    "group": {
      "type": "string",
      "enum": [
        "steam",
        "github",
        "chat",
        "media",
        "image",
        "game",
        "misc"
      ],
      "description": "分组，WebUI 按组渲染开关"
    },
    "description": {
      "type": "string"
    },
    "enabled": {
      "type": "boolean",
      "description": "是否默认启用（WebUI 可随时切换）"
    },
    "needs_files": {
      "type": [
        "array",
        "null"
      ],
      "items": {
        "type": "string"
      },
      "description": "该服务依赖的本地文件路径（相对项目根），存在才渲染。如 YouTube iframe 修复脚本"
    },
    "sites": {
      "type": "array",
      "minItems": 1,
      "items": {
        "$ref": "#/$defs/site"
      }
    }
  },
  "$defs": {
    "site": {
      "type": "object",
      "required": [
        "hosts",
        "handlers"
      ],
      "properties": {
        "hosts": {
          "type": "array",
          "minItems": 1,
          "items": {
            "type": "string",
            "pattern": "^\\*?\\.?[a-z0-9.-]+$"
          },
          "description": "域名列表，与 hosts 文件中写入的域名保持一致，将全部 →127.0.0.1"
        },
        "tls_cert": {
          "type": [
            "string",
            "null"
          ],
          "description": "证书文件（来自 env 默认）"
        },
        "tls_key": {
          "type": [
            "string",
            "null"
          ]
        },
        "pna_cors": {
          "type": "boolean",
          "description": "附加 CORS/PNA 头并处理 OPTIONS 预检（浏览器跨域与 steamloopback.host 依赖）"
        },
        "extra_headers": {
          "type": "array",
          "items": {
            "type": "object",
            "required": [
              "name",
              "value"
            ],
            "properties": {
              "name": {
                "type": "string"
              },
              "value": {
                "type": "string"
              },
              "defer": {
                "type": "boolean"
              }
            }
          },
          "description": "站点级响应头（追加/覆盖上游）"
        },
        "handlers": {
          "type": "array",
          "items": {
            "$ref": "#/$defs/handler"
          }
        },
        "prefer": {
          "type": "object",
          "description": "CDN 优选（测速顶选）。mode=node: 候选为 IP 上游解析测速，Top-N 前置，保留原 upstreams 兜底；mode=cf/cidr: 对官方 Anycast 段采样测速，仅保留通过校验的边缘，替换原上游。",
          "properties": {
            "mode": {
              "type": "string",
              "enum": [
                "node",
                "cf",
                "cidr"
              ],
              "description": "node: 固定候选 IP 测速顶选；cf/cidr: Anycast 段采样"
            },
            "port": {
              "type": "integer",
              "description": "探测端口（默认 443）"
            },
            "candidates": {
              "type": "array",
              "items": {
                "type": "string"
              },
              "description": "node 模式候选（https://IP 或 host），为空时取首个 reverse_proxy 上游"
            },
            "cidrs": {
              "type": "array",
              "items": {
                "type": "string"
              },
              "description": "cf/cidr 模式的官方 Anycast 段"
            },
            "samples_per_cidr": {
              "type": "integer",
              "description": "每段采样数（cf/cidr 默认 24）"
            },
            "speed_test": {
              "type": "boolean",
              "description": "是否对延迟最优候选做下载测速"
            },
            "download_url": {
              "type": "string",
              "description": "测速用下载 URL"
            },
            "validate": {
              "type": "boolean",
              "description": "node 模式是否用与真实链路一致的 SNI 做校验"
            },
            "validate_path": {
              "type": "string",
              "description": "校验请求路径（默认 /）"
            },
            "validate_any_status": {
              "type": "boolean",
              "description": "校验放宽：2xx/3xx/4xx 均算可达（仅拒 5xx/连接失败），用于根路径 404 但可服务的站点"
            },
            "max_mbps": {
              "type": "number",
              "description": "测速限速（MB/s）"
            },
            "top_n": {
              "type": "integer",
              "description": "保留个数（默认 2）"
            }
          },
          "additionalProperties": false
        }
      }
    },
    "handler": {
      "type": "object",
      "required": [
        "type"
      ],
      "properties": {
        "type": {
          "type": "string",
          "enum": [
            "reverse_proxy",
            "file_server",
            "respond",
            "redir",
            "rewrite"
          ]
        },
        "match": {
          "$ref": "#/$defs/match"
        },
        "upstreams": {
          "type": "array",
          "items": {
            "type": "string",
            "pattern": "^(https?://)?"
          },
          "description": "http(s) 上游列表，支持域名或 IP；留空时无法代理则该 handler 被跳过"
        },
        "dynamic_upstreams": {
          "type": "array",
          "items": {
            "type": "object",
            "required": [
              "dns",
              "host",
              "port"
            ],
            "properties": {
              "dns": {
                "type": "string",
                "description": "解析方式，当前固定 'a'"
              },
              "host": {
                "type": "string"
              },
              "port": {
                "type": "integer"
              }
            }
          },
          "description": "按 DNS 结果动态解析的上游（配合 dir-source）"
        },
        "lb": {
          "type": "object",
          "properties": {
            "policy": {
              "enum": [
                "round_robin",
                "random",
                "random_choose",
                "first",
                "ip_hash"
              ]
            },
            "choose": {
              "type": "integer",
              "description": "random_choose 随机挑几个（用于Steam多节点）"
            },
            "try_duration": {
              "type": "string",
              "description": "lb_try_duration，如 '5s'"
            },
            "fail_duration": {
              "type": "string",
              "description": "fail_duration 健康检查窗口"
            },
            "max_fails": {
              "type": "integer"
            },
            "unhealthy_latency": {
              "type": "string"
            },
            "unhealthy_status": {
              "type": "string",
              "description": "'5xx' 等"
            }
          }
        },
        "transport": {
          "type": "object",
          "properties": {
            "tls": {
              "type": "boolean"
            },
            "tls_server_name": {
              "type": [
                "string",
                "null"
              ],
              "description": "SNI 伪装：连接上游时使用的 TLS SNI"
            },
            "insecure_skip_verify": {
              "type": "boolean"
            }
          }
        },
        "header_up": {
          "type": "array",
          "description": "请求头改写：[name, value] 或 [name, match, value]（正则替换）或 [name, null] 表示删除(-前缀)",
          "items": {
            "type": "array",
            "minItems": 2,
            "maxItems": 3,
            "items": {
              "type": [
                "string",
                "null"
              ]
            }
          }
        },
        "header_down": {
          "type": "array",
          "items": {
            "type": "array",
            "minItems": 1,
            "maxItems": 3,
            "items": {
              "type": [
                "string",
                "null"
              ]
            }
          }
        },
        "respond": {
          "type": "object",
          "properties": {
            "status": {
              "type": "integer"
            },
            "body": {
              "type": "string"
            },
            "close": {
              "type": "boolean"
            }
          }
        },
        "file_server": {
          "type": "object",
          "properties": {
            "root": {
              "type": "string",
              "description": "站点根目录（相对项目根）"
            },
            "browse": {
              "type": "boolean"
            }
          }
        },
        "redir": {
          "type": "object",
          "properties": {
            "to": {
              "type": "string",
              "description": "支持 {uri}/{host} 占位符"
            },
            "permanent": {
              "type": "boolean"
            }
          }
        },
        "rewrite": {
          "type": "object",
          "properties": {
            "to": {
              "type": "string"
            }
          }
        }
      }
    },
    "match": {
      "type": "object",
      "description": "匹配条件（空/缺省 = 全部）。所有键逻辑 AND。",
      "properties": {
        "expression": {
          "type": "array",
          "items": {
            "type": "string"
          },
          "description": "Caddy CEL 表达式，如 {query}.contains(\"cdnOverride\")，逐条 AND"
        },
        "path": {
          "type": "array",
          "items": {
            "type": "string"
          }
        },
        "method": {
          "type": "array",
          "items": {
            "type": "string"
          }
        },
        "not": {
          "type": "array",
          "description": "排除条件，满足其中任一则不算匹配",
          "items": {
            "$ref": "#/$defs/match"
          }
        }
      }
    }
  }
}