{
  "schema_version": 1,
  "id": "steam_cdn_fastly",
  "name": "Steam 页面布局/图片修复 (Fastly)",
  "group": "steam",
  "description": "Fastly 前缀的 steamstatic 域名，内容来自 Akamai 边缘，SNI 伪装为 img-s-msn，Host 头放行 fastly+akamai 双前缀。",
  "enabled": true,
  "sites": [
    {
      "hosts": [
        "cdn.fastly.steamstatic.com",
        "community.fastly.steamstatic.com",
        "store.fastly.steamstatic.com",
        "avatars.fastly.steamstatic.com",
        "shared.fastly.steamstatic.com",
        "clan.fastly.steamstatic.com",
        "video.fastly.steamstatic.com"
      ],
      "pna_cors": true,
      "handlers": [
        {
          "type": "reverse_proxy",
          "upstreams": [
            "https://steamuserimages-a.akamaihd.net.edgesuite.net",
            "https://steamstore-a.akamaihd.net.edgesuite.net",
            "https://eaassets-a.akamaihd.net.edgesuite.net",
            "https://steamcommunity-a.akamaihd.net.edgesuite.net"
          ],
          "dynamic_upstreams": [
            { "dns": "a", "host": "steamuserimages-a.akamaihd.net.edgesuite.net", "port": 443 },
            { "dns": "a", "host": "steamstore-a.akamaihd.net.edgesuite.net", "port": 443 },
            { "dns": "a", "host": "eaassets-a.akamaihd.net.edgesuite.net", "port": 443 },
            { "dns": "a", "host": "steamcommunity-a.akamaihd.net.edgesuite.net", "port": 443 }
          ],
          "lb": { "policy": "random_choose", "choose": 4, "try_duration": "5s" },
          "transport": { "tls": true, "tls_server_name": "img-s-msn-com.akamaized.net", "insecure_skip_verify": false },
          "header_up": [["Host", "{host}"]]
        }
      ]
    }
  ]
}