{
  "schema_version": 1,
  "id": "steam_chat",
  "name": "Steam 好友聊天 图片修复",
  "group": "steam",
  "description": "steam-chat.com：图片上传路径走 steam302 节点，其余走 Akamai 边缘；放宽对 steamloopback.host 的 CORS。",
  "enabled": true,
  "sites": [
    {
      "hosts": ["steam-chat.com"],
      "pna_cors": true,
      "extra_headers": [
        { "name": "Access-Control-Allow-Origin", "value": "https://steamloopback.host" }
      ],
      "handlers": [
        {
          "type": "reverse_proxy",
          "match": { "method": ["POST"], "path": ["/chat/beginfileupload/*"] },
          "upstreams": [
            "https://str001.steam302.xyz",
            "https://str002.steam302.xyz",
            "https://str003.steam302.xyz"
          ],
          "lb": { "policy": "random_choose", "choose": 2, "fail_duration": "3s", "max_fails": 3, "unhealthy_latency": "1000ms", "unhealthy_status": "5xx" },
          "transport": { "tls": true, "tls_server_name": "statuspage.akamaized.net", "insecure_skip_verify": false },
          "header_up": [["Host", "{host}"]]
        },
        {
          "type": "reverse_proxy",
          "upstreams": [
            "https://steamuserimages-a.akamaihd.net.edgesuite.net",
            "https://steamstore-a.akamaihd.net.edgesuite.net",
            "https://eaassets-a.akamaihd.net.edgesuite.net",
            "https://steamcommunity-a.akamaihd.net.edgesuite.net"
          ],
          "dynamic_upstreams": [
            { "dns": "a", "host": "steamuserimages-a.akamaihd.net.edgesuite.net", "port": 443 },
            { "dns": "a", "host": "steamstore-a.akamaihd.net.edgesuite.net", "port": 443 },
            { "dns": "a", "host": "eaassets-a.akamaihd.net.edgesuite.net", "port": 443 },
            { "dns": "a", "host": "steamcommunity-a.akamaihd.net.edgesuite.net", "port": 443 }
          ],
          "lb": { "policy": "random_choose", "choose": 4, "try_duration": "5s" },
          "transport": { "tls": true, "tls_server_name": "img-s-msn-com.akamaized.net", "insecure_skip_verify": false },
          "header_up": [["Host", "{host}"]]
        }
      ]
    }
  ]
}